region_hydro_ope,periode,esp_nom_commun,esp_nom_commun_nb
A,1991,"Chevaine, Goujon, Gardon, Anguille d'Europe, Spirlin, Hotu, Vairon, Epinoche, Ablette, Loche franche, Vandoise, Lote de rivière, Barbeau fluviatile, Perche, Tanche, Brochet, Brème commune, Rotengle, Carpe commune, Perche soleil, Sandre, Brème bordelière, Gremille, Truite de riviere, Chabot, Bouvière, Loche de rivière, Carassin, Ombre commun, Lamproie de planer",30
A,1993,"Vandoise, Gardon, Chevaine, Anguille d'Europe, Goujon, Brochet, Spirlin, Ablette, Epinoche, Brème commune, Vairon, Perche, Bouvière, Barbeau fluviatile, Tanche, Sandre, Brème bordelière, Carpe miroir, Carpe commune, Hotu, Gremille, Lote de rivière, Truite de riviere, Perche soleil, Rotengle, Loche franche, Carassin, Chabot, Ombre commun, Lamproie indéterminée (genre Lampetra), Lamproie de planer, Truite arc-en-ciel, Epinochette, Loche de rivière",34
A,1995,"Goujon, Chevaine, Ablette, Vairon, Anguille d'Europe, Vandoise, Hotu, Gardon, Spirlin, Brème commune, Barbeau fluviatile, Epinoche, Loche franche, Perche, Brochet, Tanche, Perche soleil, Rotengle, Carpe commune, Sandre, Brème bordelière, Gremille, Carassin, Truite de riviere, Chabot, Lamproie de planer, Bouvière, Ombre commun, Aspe, Truite arc-en-ciel, Loche de rivière, Poisson chat, Lote de rivière",33
A,1997,"Vairon, Loche franche, Epinoche, Barbeau fluviatile, Chevaine, Anguille d'Europe, Hotu, Goujon, Truite de riviere, Chabot, Perche, Saumon atlantique, Tanche, Brochet, Gardon, Ablette, Vandoise, Brème bordelière, Carpe commune, Gremille, Brème commune, Perche soleil, Rotengle, Aspe, Lote de rivière, Spirlin, Pseudorasbora, Truite arc-en-ciel, Carassin, Carpe miroir, Ombre commun, Lamproie de planer, Bouvière, Sandre, Poisson chat, Loche de rivière",36
A,1999,"Barbeau fluviatile, Vairon, Anguille d'Europe, Hotu, Ablette, Spirlin, Chabot, Truite de riviere, Goujon, Ombre commun, Chevaine, Epinoche, Loche franche, Saumon atlantique, Perche soleil, Gardon, Vandoise, Perche, Brème commune, Aspe, Brochet, Carpe commune, Tanche, Brème bordelière, Sandre, Gremille, Rotengle, Pseudorasbora, Cyprinidés, Carassin, Carpe miroir, Able de Heckel, Lamproie de planer, Bouvière, Truite arc-en-ciel, Lote de rivière, Loche de rivière, Silure glane, Poisson chat",39
A,2001,"Vairon, Chevaine, Loche franche, Barbeau fluviatile, Goujon, Perche, Anguille d'Europe, Lamproie de planer, Chabot, Spirlin, Hotu, Blageon, Vandoise, Gardon, Epinoche, Silure glane, Ombre commun, Gremille, Truite de riviere, Brochet, Saumon atlantique, Tanche, Ablette, Perche soleil, Brème commune, Brème bordelière, Lote de rivière, Sandre, Aspe, Pseudorasbora, Carassin, Truite arc-en-ciel, Rotengle, Carpe miroir, Able de Heckel, Bouvière, Carrassin doré, Loche de rivière, Carpe commune, Poisson chat, Ide melanote",41
A,2003,"Vairon, Chevaine, Loche franche, Barbeau fluviatile, Spirlin, Epinoche, Goujon, Gardon, Anguille d'Europe, Hotu, Gremille, Lamproie de planer, Chabot, Ablette, Vandoise, Perche, Truite de riviere, Saumon atlantique, Carpe commune, Tanche, Brochet, Rotengle, Sandre, Silure glane, Brème bordelière, Perche soleil, Brème commune, Lamproie indéterminée (genre Lampetra), Pseudorasbora, Truite arc-en-ciel, Carrassin doré, Able de Heckel, Carassin, Ombre commun, Bouvière, Aspe, Cyprinidés, Lote de rivière, Lamproie marine, Loche de rivière, Poisson chat, Carpe miroir",42
A,2005,"Vairon, Chevaine, Loche franche, Goujon, Epinoche, Lamproie indéterminée (genre Lampetra), Truite de riviere, Spirlin, Perche, Anguille d'Europe, Saumon atlantique, Barbeau fluviatile, Gardon, Hotu, Ombre commun, Gremille, Brochet, Lamproie de planer, Tanche, Silure glane, Perche soleil, Brème commune, Ablette, Sandre, Rotengle, Aspe, Vandoise, Carpe commune, Pseudorasbora, Lote de rivière, Chabot, Poisson chat, Truite arc-en-ciel, Carassin argente, Carrassin doré, Bouvière, Brème bordelière, Loche de rivière, Ide melanote, Epinochette, Able de Heckel, Carpe miroir, Saumon de fontaine, Carassin",44
A,2007,"Vairon, Chevaine, Loche franche, Goujon, Epinoche, Hotu, Gardon, Anguille d'Europe, Lamproie de planer, Spirlin, Barbeau fluviatile, Chabot, Pseudorasbora, Saumon atlantique, Truite de riviere, Perche, Ablette, Carpe commune, Lamproie indéterminée (genre Lampetra), Brème commune, Vandoise, Silure glane, Perche soleil, Brochet, Gremille, Aspe, Tanche, Bouvière, Lote de rivière, Sandre, Gobie demi-lune, Brème bordelière, Truite arc-en-ciel, Carassin argente, Carassin, Rotengle, Carpe miroir, Ombre commun, Loche de rivière, Ide melanote, Poisson chat, Carrassin doré, Epinochette, Cyprinidés, Able de Heckel, Hybride brème-gardon",46
A,2009,"Vairon, Loche franche, Chevaine, Epinoche, Goujon, Truite de riviere, Barbeau fluviatile, Hotu, Anguille d'Europe, Chabot, Gremille, Tanche, Gardon, Brochet, Spirlin, Perche, Bouvière, Brème commune, Ablette, Perche soleil, Silure glane, Vandoise, Rotengle, Lamproie de planer, Aspe, Pseudorasbora, Gobie demi-lune, Sandre, Carpe miroir, Carpe commune, Able de Heckel, Saumon atlantique, Ombre commun, Truite arc-en-ciel, Brème bordelière, Loche de rivière, Lote de rivière, Carassin argente, Carassin, Poisson chat, Epinochette",41
A,2011,"Vairon, Loche franche, Hotu, Barbeau fluviatile, Chevaine, Epinoche, Goujon, Saumon atlantique, Truite de riviere, Spirlin, Gardon, Silure glane, Perche soleil, Perche, Brochet, Ablette, Anguille d'Europe, Brème commune, Tanche, Gobie demi-lune, Vandoise, Aspe, Gremille, Sandre, Carpe commune, Lamproie de planer, Bouvière, Gobie de kessler, Gobie à tache noire, Chabot, Lote de rivière, Pseudorasbora, Truite arc-en-ciel, Able de Heckel, Ombre commun, Rotengle, Loche de rivière, Brème bordelière, Carassin argente, Carpe miroir, Poisson chat, Epinochette, Carassin",43
A,2013,"Barbeau fluviatile, Chevaine, Hotu, Ablette, Perche, Loche franche, Gobie de kessler, Truite de riviere, Epinoche, Vairon, Gardon, Silure glane, Chabot, Anguille d'Europe, Perche soleil, Brème indéterminée, Bouvière, Blageon, Goujon, Tanche, Pseudorasbora, Brochet, Gobie à tache noire, Brème bordelière, Gobie demi-lune, Vandoise, Spirlin, Brème commune, Aspe, Rotengle, Carpe commune, Lamproie de planer, Carassin, Lamproie indéterminée (genre Lampetra), Saumon atlantique, Lote de rivière, Ombre commun, Lamproie marine, Ide melanote, Loche de rivière, Truite arc-en-ciel, Gremille, Carassin argente, Sandre, Able de Heckel, Carpe miroir, Epinochette",47
A,2015,"Chevaine, Gobie à tache noire, Barbeau fluviatile, Hotu, Ablette, Vairon, Gobie de kessler, Loche franche, Epinoche, Truite de riviere, Silure glane, Perche soleil, Loche de rivière, Spirlin, Gardon, Perche, Saumon atlantique, Blageon, Goujon, Pseudorasbora, Tanche, Bouvière, Rotengle, Brochet, Gobie demi-lune, Anguille d'Europe, Brème commune, Brème bordelière, Vandoise, Sandre, Carpe commune, Lamproie de planer, Aspe, Carassin argente, Gremille, Chabot, Poisson chat, Truite arc-en-ciel, Carassin, Ombre commun, Carpe miroir, Lote de rivière, Brème indéterminée, Able de Heckel, Epinochette, Ide melanote, Gobie fluviatile",47
A,2017,"Gobie à tache noire, Chevaine, Hotu, Barbeau fluviatile, Gardon, Vairon, Aspe, Loche franche, Silure glane, Pseudorasbora, Tanche, Brochet, Epinoche, Loche de rivière, Ablette, Perche, Saumon atlantique, Truite de riviere, Goujon, Rotengle, Bouvière, Vandoise, Gobie demi-lune, Anguille d'Europe, Brème bordelière, Carpe commune, Sandre, Perche soleil, Spirlin, Gobie de kessler, Brème indéterminée, Carassin argente, Gremille, Chabot, Truite arc-en-ciel, Lamproie de planer, Carassin, Lote de rivière, Ombre commun, Carpe miroir, Brème commune, Able de Heckel, Cyprinidés, Epinochette, Gobie fluviatile",45
A,2019,"Gobie à tache noire, Chevaine, Ablette, Hotu, Barbeau fluviatile, Gobie demi-lune, Gobie de kessler, Vairon, Silure glane, Gardon, Loche italienne, Perche, Vandoise, Brochet, Epinoche, Saumon atlantique, Blageon, Goujon, Pseudorasbora, Rotengle, Tanche, Bouvière, Perche soleil, Brème commune, Aspe, Loche franche, Brème indéterminée, Anguille d'Europe, Brème bordelière, Spirlin, Carpe miroir, Carpe commune, Sandre, Chabot, Poisson chat, Truite de riviere, Lamproie de planer, Able de Heckel, Ombre commun, Carassin argente, Gremille, Loche de rivière, Lote de rivière, Carassin indéterminé, Epinochette, Gobie fluviatile, Carassin, Truite arc-en-ciel",48
B,1991,"Truite de riviere, Chabot, Spirlin, Vairon, Loche franche, Vandoise, Goujon, Chevaine, Barbeau fluviatile, Hotu, Epinoche, Ablette, Lamproie de planer, Gardon, Gremille, Perche, Tanche, Brochet, Brème bordelière, Anguille d'Europe",20
B,1993,"Vairon, Goujon, Loche franche, Gardon, Ablette, Chevaine, Chabot, Vandoise, Barbeau fluviatile, Truite de riviere, Hotu, Brème commune, Brème bordelière, Brochet, Gremille, Rotengle, Tanche, Perche, Perche soleil, Carassin, Anguille d'Europe, Bouvière, Epinoche, Spirlin, Lamproie de planer, Carpe commune, Ombre commun",27
B,1995,"Chevaine, Goujon, Gardon, Loche franche, Bouvière, Vandoise, Brochet, Vairon, Tanche, Epinoche, Chabot, Ablette, Barbeau fluviatile, Spirlin, Hotu, Lamproie de planer, Brème commune, Brème bordelière, Loche de rivière, Gremille, Perche, Truite de riviere, Rotengle, Anguille d'Europe, Perche soleil, Carassin, Lote de rivière, Ombre commun",28
B,1997,"Gardon, Chevaine, Goujon, Vandoise, Loche franche, Brochet, Ablette, Vairon, Rotengle, Epinochette, Epinoche, Chabot, Spirlin, Hotu, Barbeau fluviatile, Tanche, Brème bordelière, Truite de riviere, Bouvière, Perche, Loche de rivière, Perche soleil, Anguille d'Europe, Lote de rivière, Gremille, Brème commune, Lamproie de planer, Carassin, Ombre commun",29
B,1999,"Goujon, Gardon, Loche franche, Vandoise, Chevaine, Vairon, Epinoche, Ablette, Brochet, Bouvière, Tanche, Perche, Chabot, Spirlin, Hotu, Barbeau fluviatile, Loche de rivière, Brème commune, Rotengle, Carpe commune, Brème bordelière, Truite de riviere, Gremille, Perche soleil, Lote de rivière, Anguille d'Europe, Lamproie de planer, Ombre commun",28
B,2001,"Goujon, Gardon, Chevaine, Loche franche, Vairon, Epinoche, Vandoise, Ablette, Bouvière, Brème commune, Rotengle, Tanche, Carpe miroir, Brochet, Brème bordelière, Chabot, Barbeau fluviatile, Spirlin, Hotu, Carpe commune, Carassin, Perche, Lamproie indéterminée (genre Lampetra), Truite de riviere, Loche de rivière, Perche soleil, Gremille, Lote de rivière, Anguille d'Europe, Ombre commun, Lamproie de planer, Epinochette",32
B,2003,"Chevaine, Gardon, Goujon, Vairon, Loche franche, Vandoise, Perche, Tanche, Carpe commune, Brème bordelière, Hotu, Bouvière, Brochet, Epinoche, Ablette, Carpe miroir, Spirlin, Barbeau fluviatile, Chabot, Loche de rivière, Gremille, Truite de riviere, Carassin, Lamproie de planer, Rotengle, Brème commune, Lamproie indéterminée (genre Lampetra), Epinochette, Anguille d'Europe, Perche soleil, Lote de rivière, Silure glane, Able de Heckel, Ombre commun",34
B,2005,"Goujon, Chevaine, Vairon, Gardon, Ablette, Vandoise, Tanche, Brochet, Perche, Epinoche, Brème bordelière, Loche franche, Carpe miroir, Rotengle, Bouvière, Hotu, Barbeau fluviatile, Spirlin, Chabot, Loche de rivière, Brème commune, Gremille, Epinochette, Carpe commune, Lamproie indéterminée (genre Lampetra), Perche soleil, Truite de riviere, Lamproie de planer, Lote de rivière, Anguille d'Europe, Sandre, Silure glane, Truite arc-en-ciel, Saumon de fontaine, Carassin, Ombre commun",36
B,2007,"Goujon, Gardon, Vairon, Loche franche, Chevaine, Ablette, Tanche, Perche, Brochet, Vandoise, Chabot, Brème bordelière, Epinoche, Bouvière, Carassin, Spirlin, Barbeau fluviatile, Hotu, Brème commune, Loche de rivière, Carpe miroir, Carpe commune, Carrassin doré, Gremille, Truite de riviere, Lamproie de planer, Rotengle, Epinochette, Lote de rivière, Anguille d'Europe, Perche soleil, Sandre, Silure glane, Ombre commun, Carpe cuir",35
B,2009,"Goujon, Gardon, Vairon, Loche franche, Chevaine, Ablette, Epinoche, Vandoise, Perche, Chabot, Brochet, Brème bordelière, Tanche, Able de Heckel, Rotengle, Spirlin, Carpe commune, Barbeau fluviatile, Loche de rivière, Hotu, Gremille, Bouvière, Truite de riviere, Lamproie de planer, Epinochette, Lote de rivière, Brème commune, Perche soleil, Anguille d'Europe, Lamproie indéterminée (genre Lampetra), Cyprinidés, Silure glane, Carassin, Ombre commun, Sandre",35
B,2011,"Goujon, Gardon, Vairon, Chevaine, Ablette, Vandoise, Loche franche, Perche, Brème commune, Epinoche, Bouvière, Rotengle, Tanche, Hotu, Brème bordelière, Brochet, Carassin argente, Chabot, Carassin, Barbeau fluviatile, Loche de rivière, Gremille, Spirlin, Truite de riviere, Lamproie de planer, Epinochette, Hybride brème-gardon, Anguille d'Europe, Silure glane, Ide melanote, Carpe commune, Lote de rivière, Ombre commun",33
B,2013,"Vairon, Gardon, Goujon, Chevaine, Bouvière, Loche franche, Ablette, Epinoche, Tanche, Rotengle, Spirlin, Perche, Carpe miroir, Brochet, Vandoise, Chabot, Barbeau fluviatile, Loche de rivière, Brème bordelière, Hotu, Brème commune, Gremille, Truite de riviere, Lamproie de planer, Epinochette, Carassin, Perche soleil, Hybride brème-gardon, Silure glane, Brème indéterminée, Carassin argente, Lote de rivière, Ombre commun, Carassin doré, Anguille d'Europe",35
B,2015,"Goujon, Gardon, Chevaine, Vairon, Loche franche, Ablette, Bouvière, Perche, Rotengle, Barbeau fluviatile, Brème bordelière, Epinoche, Spirlin, Brème commune, Hotu, Vandoise, Gremille, Carassin argente, Chabot, Tanche, Loche de rivière, Truite de riviere, Carpe commune, Lamproie de planer, Epinochette, Brochet, Lote de rivière, Sandre, Perche soleil, Carassin, Silure glane, Brème indéterminée, Carrassin doré, Ombre commun",34
B,2017,"Goujon, Gardon, Vairon, Chevaine, Ablette, Bouvière, Perche, Loche franche, Spirlin, Vandoise, Brochet, Tanche, Barbeau fluviatile, Brème commune, Hotu, Rotengle, Chabot, Brème bordelière, Loche de rivière, Carpe commune, Gremille, Lamproie de planer, Carpe miroir, Epinoche, Truite de riviere, Epinochette, Silure glane, Gobie demi-lune, Lote de rivière, Brème indéterminée, Perche soleil, Carassin argente, Saumon de fontaine, Able de Heckel, Ide melanote, Ombre commun, Anguille d'Europe, Gobie à tache noire",38
B,2019,"Gardon, Chevaine, Ablette, Bouvière, Goujon, Vairon, Loche franche, Brochet, Vandoise, Perche, Tanche, Spirlin, Hotu, Chabot, Brème bordelière, Carassin, Barbeau fluviatile, Perche soleil, Brème indéterminée, Gremille, Loche de rivière, Carpe commune, Truite de riviere, Lamproie de planer, Epinoche, Epinochette, Gobie demi-lune, Silure glane, Brème commune, Rotengle, Lote de rivière, Loche d'étang, Sandre, Able de Heckel, Pseudorasbora, Carassin indéterminé, Carassin argente, Ombre commun, Carpe miroir, Gobie à tache noire",40
D,1995,"Goujon, Gardon, Chevaine, Ablette, Spirlin, Vandoise, Loche franche, Vairon, Perche, Gremille, Chabot, Loche de rivière, Hotu, Carpe cuir, Epinoche, Carpe miroir, Carassin, Tanche, Brochet, Brème commune, Ide melanote",21
D,1997,"Goujon, Chevaine, Gardon, Ablette, Loche franche, Vairon, Vandoise, Spirlin, Loche de rivière, Chabot, Brochet, Gremille, Perche, Epinoche, Truite arc-en-ciel",15
D,1999,"Goujon, Chevaine, Loche franche, Gardon, Ablette, Vairon, Loche de rivière, Vandoise, Spirlin, Chabot, Perche, Gremille",12
D,2001,"Loche franche, Chevaine, Goujon, Vairon, Gardon, Vandoise, Spirlin, Loche de rivière, Ablette, Chabot, Epinoche, Gremille, Brochet, Perche, Tanche",15
D,2003,"Loche franche, Gardon, Chevaine, Vandoise, Goujon, Vairon, Loche de rivière, Spirlin, Rotengle, Epinoche, Perche, Bouvière, Chabot, Ablette, Tanche, Gremille, Hotu, Brème commune, Brochet, Carassin, Ide melanote",21
D,2005,"Chabot, Loche franche, Gardon, Goujon, Vandoise, Chevaine, Gremille, Ablette, Brème commune, Perche, Epinoche, Bouvière, Sandre, Truite arc-en-ciel, Vairon, Spirlin, Loche de rivière, Tanche, Brochet, Carassin, Rotengle, Truite de riviere",22
D,2007,"Chabot, Loche franche, Perche, Ablette, Gardon, Chevaine, Goujon, Vandoise, Gremille, Vairon, Truite de riviere, Spirlin, Loche de rivière, Brochet, Rotengle, Bouvière, Barbeau fluviatile, Able de Heckel, Carpe commune, Brème commune, Epinoche, Tanche, Brème bordelière, Loche d'étang",24
D,2009,"Loche franche, Chabot, Perche, Ablette, Goujon, Vandoise, Chevaine, Gardon, Truite arc-en-ciel, Truite de riviere, Vairon, Loche de rivière, Spirlin, Gremille, Bouvière, Epinoche, Brochet, Brème bordelière, Rotengle, Carassin, Barbeau fluviatile, Lamproie de planer, Carpe commune",23
D,2011,"Chabot, Loche franche, Goujon, Ablette, Vandoise, Truite de riviere, Perche, Chevaine, Vairon, Gremille, Gardon, Epinoche, Loche de rivière, Brochet, Barbeau fluviatile, Carassin doré, Cyprinidés, Bouvière, Brème commune, Rotengle, Tanche, Carpe miroir, Lamproie de planer, Truite arc-en-ciel",24
D,2013,"Gardon, Ablette, Chabot, Loche franche, Goujon, Chevaine, Vandoise, Bouvière, Perche, Brème commune, Truite de riviere, Vairon, Gremille, Truite arc-en-ciel, Loche de rivière, Epinoche, Barbeau fluviatile, Pseudorasbora, Rotengle, Brochet, Brème bordelière, Lamproie de planer, Carassin argente, Carpe commune",24
D,2015,"Chabot, Loche franche, Vandoise, Goujon, Vairon, Chevaine, Ablette, Gardon, Bouvière, Gremille, Perche, Epinoche, Barbeau fluviatile, Brochet, Rotengle, Brème bordelière, Pseudorasbora, Able de Heckel, Loche de rivière, Tanche, Truite de riviere, Brème commune, Lamproie de planer",23
D,2017,"Loche franche, Vairon, Vandoise, Chevaine, Perche, Goujon, Gardon, Ablette, Loche de rivière, Chabot, Barbeau fluviatile, Tanche, Epinoche, Spirlin, Brème commune, Brème bordelière, Truite de riviere, Anguille d'Europe, Bouvière, Brochet, Cyprinidés, Rotengle, Carassin argente, Carrassin doré, Lamproie de planer, Carpe miroir, Carpe commune, Able de Heckel",28
D,2019,"Vairon, Vandoise, Loche franche, Chevaine, Ablette, Gardon, Goujon, Chabot, Barbeau fluviatile, Loche de rivière, Bouvière, Tanche, Perche, Brochet, Gremille, Epinoche, Anguille d'Europe, Truite de riviere, Able de Heckel, Carassin argente, Rotengle",21
E,1993,"Truite de riviere, Chabot, Gardon, Anguille d'Europe",4
E,1995,"Gardon, Perche, Goujon, Epinoche, Rotengle, Tanche, Bouvière, Gremille, Brème commune, Anguille d'Europe, Brochet, Sandre, Truite arc-en-ciel, Loche franche, Chevaine, Epinochette, Chabot, Truite de riviere, Vairon, Lamproie de planer, Carassin, Carpe miroir, Ablette, Vandoise, Truite de mer, Loche de rivière, Lamproie de rivière, Barbeau fluviatile",28
E,1997,"Gardon, Goujon, Brème commune, Perche, Rotengle, Anguille d'Europe, Brème bordelière, Perche soleil, Loche franche, Pseudorasbora, Tanche, Brochet, Chevaine, Epinochette, Bouvière, Epinoche, Able de Heckel, Chabot, Truite de riviere, Vairon, Lamproie de planer, Truite arc-en-ciel, Ablette, Gremille, Carassin, Truite de mer, Loche de rivière, Vandoise, Sandre, Barbeau fluviatile",30
E,1999,"Chabot, Vairon, Anguille d'Europe, Lamproie marine, Truite de riviere, Lamproie de planer, Epinoche, Lamproie de rivière, Truite arc-en-ciel, Gardon, Perche, Goujon, Sandre, Brème commune, Gremille, Ablette, Tanche, Rotengle, Loche franche, Bouvière, Brochet, Brème bordelière, Able de Heckel, Loche de rivière, Carpe miroir, Carassin, Truite de mer, Perche soleil, Vandoise, Epinochette, Chevaine, Barbeau fluviatile",32
E,2001,"Chabot, Vairon, Anguille d'Europe, Truite de riviere, Lamproie de planer, Ablette, Gardon, Perche, Goujon, Loche franche, Brème commune, Gremille, Brème bordelière, Carassin, Bouvière, Carpe commune, Rotengle, Epinoche, Chevaine, Tanche, Brochet, Sandre, Truite arc-en-ciel, Loche de rivière, Vandoise, Truite de mer, Flet commun, Perche soleil",28
E,2003,"Vairon, Chabot, Anguille d'Europe, Lamproie de planer, Gardon, Truite de riviere, Epinoche, Vandoise, Lamproie de rivière, Truite arc-en-ciel, Loche franche, Goujon, Chevaine, Brème commune, Ablette, Tanche, Perche, Sandre, Bouvière, Pseudorasbora, Epinochette, Perche soleil, Gremille, Brème bordelière, Loche de rivière, Rotengle, Brochet, Able de Heckel, Truite de mer, Barbeau fluviatile, Lamproie marine",31
E,2005,"Vairon, Anguille d'Europe, Chabot, Lamproie de planer, Truite de riviere, Perche, Gardon, Truite arc-en-ciel, Carpe commune, Truite de mer, Epinoche, Goujon, Bouvière, Perche soleil, Brème commune, Loche franche, Pseudorasbora, Brochet, Sandre, Chevaine, Tanche, Rotengle, Brème bordelière, Ablette, Loche de rivière, Carassin, Carpe miroir, Gremille, Poisson chat, Saumon atlantique, Epinochette, Vandoise, Barbeau fluviatile, Cyprinidés",34
E,2007,"Chabot, Vairon, Anguille d'Europe, Truite de riviere, Lamproie de planer, Flet commun, Truite de mer, Perche, Gardon, Goujon, Bouvière, Tanche, Perche soleil, Brème bordelière, Carassin, Sandre, Chevaine, Epinoche, Truite arc-en-ciel, Loche franche, Carpe commune, Carpe cuir, Able de Heckel, Rotengle, Loche de rivière, Brochet, Brème commune, Ablette, Vandoise, Pseudorasbora, Epinochette, Gremille, Mulet porc, Barbeau fluviatile",34
E,2009,"Chabot, Anguille d'Europe, Truite de riviere, Vairon, Lamproie indéterminée (genre Lampetra), Lamproie de planer, Gardon, Epinoche, Loche franche, Goujon, Chevaine, Vandoise, Brème commune, Perche, Brème bordelière, Brochet, Bouvière, Rotengle, Tanche, Gremille, Sandre, Loche de rivière, Ablette, Carassin, Truite arc-en-ciel, Perche soleil, Epinochette, Able de Heckel, Pseudorasbora, Truite de mer, Saumon atlantique, Barbeau fluviatile, Lamproie de rivière, Flet commun",34
E,2011,"Chabot, Truite de riviere, Anguille d'Europe, Vairon, Lamproie indéterminée (genre Lampetra), Carpe commune, Loche franche, Goujon, Gardon, Chevaine, Lamproie de planer, Perche, Brème commune, Rotengle, Epinoche, Tanche, Loche de rivière, Bouvière, Brème bordelière, Brochet, Carassin, Gremille, Ablette, Sandre, Truite arc-en-ciel, Cyprinidés, Pseudorasbora, Perche soleil, Able de Heckel, Epinochette, Vandoise, Truite de mer, Silure glane, Flet commun, Mulet porc",35
E,2013,"Chabot, Vairon, Anguille d'Europe, Truite de riviere, Lamproie indéterminée (genre Lampetra), Truite arc-en-ciel, Epinoche, Lamproie de planer, Perche, Truite de mer, Loche franche, Goujon, Gardon, Chevaine, Rotengle, Brème bordelière, Tanche, Perche soleil, Brème commune, Carpe commune, Pseudorasbora, Bouvière, Ablette, Brochet, Gremille, Carassin, Loche de rivière, Epinochette, Sandre, Carassin indéterminé, Vandoise, Flet commun",32
E,2015,"Chabot, Vairon, Anguille d'Europe, Truite de riviere, Lamproie de rivière, Lamproie indéterminée (genre Lampetra), Epinoche, Lamproie de planer, Truite arc-en-ciel, Loche franche, Gardon, Goujon, Chevaine, Perche, Carassin argente, Carpe miroir, Carpe commune, Rotengle, Tanche, Brème commune, Carassin, Bouvière, Ablette, Brochet, Gremille, Loche de rivière, Hybride brème-gardon, Brème bordelière, Sandre, Perche soleil, Pseudorasbora, Epinochette, Able de Heckel, Saumon atlantique, Truite de mer, Ombre commun, Cyprinidés, Vandoise, Flet commun",39
E,2017,"Chabot, Vairon, Anguille d'Europe, Truite de riviere, Lamproie indéterminée (genre Lampetra), Epinoche, Lamproie de rivière, Truite de mer, Loche franche, Goujon, Gardon, Chevaine, Lamproie de planer, Carassin argente, Pseudorasbora, Tanche, Perche, Gobie à tache noire, Carpe agentée, Bouvière, Rotengle, Perche soleil, Brème commune, Loche de rivière, Brochet, Gremille, Able de Heckel, Truite arc-en-ciel, Epinochette, Brème bordelière, Sandre, Brème indéterminée, Vandoise, Ablette, Carassin, Saumon atlantique, Carrassin doré, Carpe commune, Flet commun, Silure glane, Barbeau fluviatile",41
E,2019,"Vairon, Chabot, Anguille d'Europe, Truite de riviere, Lamproie indéterminée (genre Lampetra), Lamproie de planer, Loche franche, Chevaine, Goujon, Gardon, Brème commune, Brochet, Gobie à tache noire, Perche, Loche de rivière, Tanche, Bouvière, Rotengle, Perche soleil, Ablette, Brème indéterminée, Brème bordelière, Epinoche, Gremille, Truite arc-en-ciel, Carassin, Epinochette, Carpe commune, Vandoise, Carassin argente, Pseudorasbora, Ide melanote, Saumon atlantique, Truite de mer, Flet commun, Silure glane, Barbeau fluviatile",37
F,1991,"Chevaine, Gardon, Ablette, Barbeau fluviatile, Bouvière, Goujon, Anguille d'Europe, Vandoise, Perche, Gremille, Rotengle, Loche franche, Brème bordelière, Hotu, Tanche, Brochet, Brème commune, Lote de rivière, Loche de rivière, Poisson chat, Sandre, Carpe commune",22
F,1993,"Gardon, Brème bordelière, Goujon, Chabot, Loche franche, Gremille, Perche, Vandoise, Brochet, Chevaine, Ablette, Brème commune, Anguille d'Europe, Hotu, Loche de rivière, Rotengle, Sandre, Tanche, Barbeau fluviatile, Bouvière, Truite arc-en-ciel, Vairon, Truite de riviere, Ombre commun, Epinoche, Lamproie de planer, Epinochette, Carpe commune, Carpe miroir, Lote de rivière",30
F,1995,"Vairon, Loche franche, Goujon, Chabot, Truite de riviere, Chevaine, Blageon, Barbeau fluviatile, Vandoise, Gardon, Lamproie de planer, Ablette, Anguille d'Europe, Perche, Hotu, Brème commune, Brochet, Gremille, Bouvière, Perche soleil, Tanche, Epinochette, Brème bordelière, Rotengle, Spirlin, Lote de rivière, Sandre, Ombre commun, Truite arc-en-ciel, Loche de rivière, Poisson chat, Carassin, Pseudorasbora, Carpe commune, Epinoche, Carrassin doré, Carpe miroir",37
